{
  "kind": "request",
  "id": "write-log",
  "owner": "diagnostics",
  "summary": "Write records to the host log.",
  "status": "target",
  "goal": {
    "type": "object",
    "properties": {
      "written": {
        "type": "integer",
        "minimum": 0
      }
    },
    "required": [
      "written"
    ]
  },
  "accepts": {
    "type": "object",
    "properties": {
      "records": {
        "type": "array",
        "items": {
          "type": "object",
          "properties": {},
          "required": []
        }
      }
    },
    "required": [
      "records"
    ]
  },
  "reasons": [
    "cleans"
  ],
  "servedBy": [
    "driver:host-log"
  ]
}
